NewsType,News,Impact
science,"Eating disorders are complicated illnesses. They impact almost every part of the body, including the heart, brain and even emotions. nicoletaionescu/Getty Images hide caption Eating disorders are complicated illnesses. They impact almost every part of the body, including the heart, brain and even emotions. Eating disorders among teenagers skyrocketed during the COVID-19 pandemic. Teens like Moorea Friedmann were isolated, spending more time in front of their computers watching movies and TV, where characters often seemed... perfect. ""You see the protagonist and they're all so beautiful,"" Friedmann says. ""And you're like, 'Do I have to look like that to be worthy? To be lovable?'"" Friedmann was already struggling with perfectionism and anxiety, and says she started to feel awful about herself. ""The world was spiraling out of control, and my body was spiraling out of control. And so what did I try to do? I tried to control it,"" she says. Eventually, Friedmann says she stopped getting her period, a condition called amenorrhea that signals the body's hormones aren't functioning properly. A doctor told her that her heart wasn't doing well, and Friedmann realized she was stuck in patterns that were hurting her mind and body. Eating disorders are complicated illnesses. Pediatrician Eva Trujillo says they ""literally rewire the brain,"" decrease brain size, and make it harder to concentrate and to regulate emotions. Malnutrition can slow the metabolism, impact bone density and even lead to cardiac arrest. Trujillo says that with the right treatment, people can also recover fully. ""But the brain needs time, food, therapy and compassion to heal,"" she says. Trujillo is the president of the International Association of Eating Disorder Professionals . She is also a co-founder of Comenzar de Nuevo , a leading treatment facility in Latin America, where patients of all ages and walks of life can get support and skill-build as they recover. For Friedmann, recovery also includes advocating for other teens struggling with eating disorders and other mental health conditions. She started a mental health and wellness podcast called Balancing Act . ""As I was digging myself out of this hole, I realized that I wanted to help other people who felt like they had been battling with this alone,"" she says. ""Because I knew what it was like to struggle alone."" For more resources and support, check out the National Eating Disorders Association . Want us to cover more mental health topics? Tell us by emailing shortwave@npr.org ! We'd love to know what you want to hear from us! Listen to every episode of Short Wave sponsor-free and support our work at NPR by signing up for Short Wave+ at plus.npr.org/shortwave . Listen to Short Wave on Spotify and Apple Podcasts . This episode was produced by Rachel Carlson. It was edited by Rebecca Ramirez. Tyler Jones checked the facts. Maggie Luthar was the audio engineer.",High
science,"Newborn babies lie in bassinets in the nursery of a postpartum recovery center in upstate New York in 2017. A new study examined births over decades to find tendencies toward having all girls or all boys. Seth Wenig/AP hide caption Couples who've been surprised by a string of baby boys or baby girls could be forgiven for wondering whether the odds in the offspring lottery are more than just pure chance. A new study by Harvard University researchers that examines the birthing records of 58,007 women suggests their hunch might be correct. The authors of the study, published in the journal Science Advances last week , found that instead of straight 50/50 odds between boys and girls with each birth, the offspring in families with at least three children tend to follow what scientists call a ""weighted coin toss,"" indicating that each family may have a distinct tendency toward girls or boys. ""We're seeing a lot of us having only boys or girls,"" says Siwen Wang, a doctoral student at the Harvard T.H. Chan School of Public Health and the lead author in the study. That led her and colleagues to wonder ""whether it's simply by chance, or is there any underlying biology explaining these sex clustering within families?"" They analyzed data from the second and third iteration of the Nurses' Health Study , which tracked just over 146,000 pregnancies across the U.S. from 1956 to 2015. They found that if the first two children born in a family are girls, the chances of the third child also being a girl are higher than for a boy — and this pattern continues with subsequent children. The same holds true if the first two are boys: The likelihood of having another boy increases, and the trend persists through later births. ""Notably, in families with three boys (MMM), the probability of having another boy was 61%; in families with three girls (FFF), the probability of having another girl was 58%,"" the study authors wrote. Looking for a possible explanation, ""one of the things that stands out is age at first birth — that's associated with a moderately higher chance of having only boys or girls,"" Wang says. ""If you're starting your family younger than 23 ... [there is] around a 40% chance of having a same-sex family,"" she says. If the woman begins having children after age 28, it's around 50% — a relatively small but statistically significant difference. The researchers excluded families with only one child and pregnancies ending in miscarriage, stillbirth or twins. Women with a history of infertility treatments were also left out of the study. To avoid bias from parents who stopped having children after reaching a preferred sex ratio, the researchers did not count each woman's final birth in the analysis. The researchers speculate that in older women, shorter menstrual cycles could factor into the results and that changes in vaginal acidity might favor the survival of sperm carrying either the Y (boys) or X (girls) chromosome. However, they note that because maternal and paternal ages are often correlated, the father's age might also play a role. Since the study included only women, the authors emphasize that the exact mechanism remains uncertain. ""We don't have data about the dad,"" Wang says. ""We don't have data about his genetics or even very precise characteristics ... which is obviously important for sex determination."" It's a concern also raised by Mark Gerstein, a professor at Yale University who wasn't involved in the research. Gerstein specializes in applying computational approaches to molecular biology. ""Given the disparity observed for mothers in the study, one could easily envision an equally impactful relationship with either the genetics or age of the father,"" he says. ""This seems like a promising area for future research to explore."" Ralph Catalano, an emeritus professor of public health at the University of California, Berkeley, who also wasn't involved in the research, thinks that the study's narrow focus on sex at birth may not show the full picture. ""Fewer than 50% of conceptions reach birth. More than 50% are spontaneously aborted [miscarried], and that's not a random draw,"" he says. Due to immunological and developmental sensitivity, females are more likely to be spontaneously aborted early in pregnancy, while males are more vulnerable to spontaneous abortion later in pregnancy because they are physically frailer, he says. ""The sex of infants we see — those who make it to birth — is shaped as much by in utero selection as by sex at conception,"" he says. Another caveat is the composition of the sample. The Nurses' Health Study that the sample was drawn from is made up of overwhelmingly white women residing in the United States. ""Since sex preferences and reproductive behaviors vary across cultures, religions, or countries … the sex ratio distribution pattern observed in our study may not apply to other societies,"" the researchers acknowledge.",High
science,"Tiny variations in the weather, tides and even the liquid inside the Earth's core can affect the length of the day. NASA hide caption If today feels like it's flying by, you can blame it on our spinning planet: A group of scientists tracking Earth's rotation predicts that the day will be a fraction of a second shorter than normal. The International Earth Rotation and Reference Systems Service , which measures the Earth's rotation and forecasts the length of the day, has predicted that July 22 could come out about a millisecond short of a standard 24-hour spin. Variations in the Earth's rotation are not uncommon: On July 9, for example, the Earth's quick spin shortened the day by nearly 1.4 milliseconds. But recent headlines from all over the world have been hyping ""freakishly short"" days in July and August. Scientific experts who constantly monitor the Earth's rotation seem a bit baffled and amused that a few slightly more-speedy-than-normal spins this summer have captured the public's imagination. ""We've known about the rotation of the Earth being variable for about a hundred years,"" says Dennis McCarthy, the former director of time at the U.S. Naval Observatory. ""This is just one of those little variations that comes along."" McCarthy, who's literally written the book on time and Earth's rotation, says the speed of the planet's spin gets influenced by all kinds of factors: the gravitational influence of the moon, the effect of winds and the atmosphere, plus the movements of the Earth's liquid core. Good data on the Earth's rotation goes back thousands of years, thanks to observations of solar eclipses in China. These days, researchers around the world track the spinning of the globe by pointing radio telescopes at quasars, incredibly luminous cores of distant galaxies that are so far away, they act as fixed points in space. That kind of data, plus information from GPS systems, all gets sent to the International Earth Rotation and Reference Systems Service, which uses it to forecast the day length. Predictions are also made by others, such as the U.S. Naval Observatory. Generally speaking, over millions of years, the Earth's rotation has been slowing down, a trend that's expected to continue into the future, says McCarthy. The main reason is the moon. The moon's gravitational pull on the Earth creates ocean tides, and a process called ""tidal braking"" gradually slows the Earth's spin. ""We know it's slowing down, because we have a real good idea of the effect of the moon,"" says McCarthy. ""Although that slowing down is continuing, there are departures from that general pattern."" Specifically, over the last decade or so, there's been a bumper crop of days that are somewhat short. Last year's shortest day, July 5, 2024, was 1.65 milliseconds shorter than the usual 86,400 seconds, says Thomas Herring , a geophysicist with MIT. He says that was the shortest day since the 1950s, which is when researchers started comparing the rotation of the Earth to the very accurate time standard provided by atomic clocks that measure the regular oscillations of atoms. In the past, the world's timekeepers have occasionally resorted to adding in some ""leap seconds"" — these extra seconds keep atomic time in sync with Earth's rotation as it slows. The last time an extra second was added to the clock was in 2016. The recent speedy spins of the Earth, however, raise the possibility of instituting ""negative leap seconds,"" or basically taking away a second rather than adding one, which is something that's never been done before. ""I think it will be unlikely that a negative leap second will be invoked,"" says Herring, given that regular old leap seconds seem to be falling out of favor. While he and others say that the recent short-duration days are of little significance in and of themselves, understanding and being able to predict the precise rotation of the Earth is important for all kinds of applications—everything from launching missiles to navigation to high-tech farming. At the equator, in one second, the Earth will rotate the length of four football fields, says Nick Stamatakos, head of the Earth orientation department at the U.S. Naval Observatory. ""The Earth's moving pretty fast,"" he says. ""So any little variations will accumulate, and it's an issue."" By looking at the recent rotation history along with information about weather systems and long-term patterns, researchers can make predictions about how the Earth will spin on any given day. These predictions generally get less accurate the farther out they go. While the moon has long been the major player in controlling the speed of the Earth's rotation, one study found that humans are playing a role. Climate change is melting ice at the poles and sending water down to the equator, slowing the rotation down. The researchers believe that this effect is already lengthening the days. Some have calculated that in a worst-case scenario, climate change could eventually redistribute water in a way that would make the days milliseconds longer. That would make humans, rather than the moon, the dominant driver of changes to day length. ""We can really become the dominant drivers of Earth's rotation, due to human-induced climate change,"" says lead researcher Benedikt Soja of ETH Zürich, a university in Switzerland. ""That was really surprising, and really an interesting revelation to us.""",High
science,"""We can really become the dominant drivers of Earth's rotation, due to human-induced climate change,"" says lead researcher Benedikt Soja of ETH Zürich, a university in Switzerland. ""That was really surprising, and really an interesting revelation to us."" ""We can really become the dominant drivers of Earth's rotation, due to human-induced climate change,"" says lead researcher Benedikt Soja of ETH Zürich, a university in Switzerland. ""That was really surprising, and really an interesting revelation to us."" ""We can really become the dominant drivers of Earth's rotation, due to human-induced climate change,"" says lead researcher Benedikt Soja of ETH Zürich, a university in Switzerland. ""That was really surprising, and really an interesting revelation to us."" ""We can really become the dominant drivers of Earth's rotation, due to human-induced climate change,"" says lead researcher Benedikt Soja of ETH Zürich, a university in Switzerland. ""That was really surprising, and really an interesting revelation to us."" ""We can really become the dominant drivers of Earth's rotation, due to human-induced climate change,"" says lead researcher Benedikt Soja of ETH Zürich, a university in Switzerland. ""That was really surprising, and really an interesting revelation to us."" ""We can really become the dominant drivers of Earth's rotation, due to human-induced climate change,"" says lead researcher Benedikt Soja of ETH Zürich, a university in Switzerland. ""That was really surprising, and really an interesting revelation to us."" ""We can really become the dominant drivers of Earth's rotation, due to human-induced climate change,"" says lead researcher Benedikt Soja of ETH Zürich, a university in Switzerland. ""That was really surprising, and really an interesting revelation to us."" ""We can really become the dominant drivers of Earth's rotation, due to human-induced climate change,"" says lead researcher Benedikt Soja of ETH Zürich, a university in Switzerland. ""That was really surprising, and really an interesting revelation to us."" ""We can really become the dominant drivers of Earth's rotation, due to human-induced climate change,"" says lead researcher Benedikt Soja of ETH Zürich, a university in Switzerland. ""That was really surprising, and really an interesting revelation to us."" ""We can really become the dominant drivers of Earth's rotation, due to human-induced climate change,"" says lead researcher Benedikt Soja of ETH Zürich, a university in Switzerland. ""That was really surprising, and really an interesting revelation to us."" ""We can really become the dominant drivers of Earth's rotation, due to human-induced climate change,"" says lead researcher Benedikt Soja of ETH Zürich, a university in Switzerland. ""That was really surprising, and really an interesting revelation to us."" ""We can really become the dominant drivers of Earth's rotation, due to human-induced climate change,"" says lead researcher Benedikt Soja of ETH Zürich, a university in Switzerland. ""That was really surprising, and really an interesting revelation to us."" ""We can really become the dominant drivers of Earth's rotation, due to human-induced climate change,"" says lead researcher Benedikt Soja of ETH Zürich, a university in Switzerland. ""That was really surprising, and really an interesting revelation to us."" ""We can really become the dominant drivers of Earth's rotation, due to human-induced climate change,"" says lead researcher Benedikt Soja of ETH Zürich, a university in Switzerland. ""That was really surprising, and really an interesting revelation to us."" ""We can really become the dominant drivers of Earth's rotation, due to human-induced climate change,"" says lead researcher Benedikt Soja of ETH Zürich, a university in Switzerland. ""That was really surprising, and really an interesting revelation to us."" ""We can really become the dominant drivers of Earth's rotation, due to human-induced climate change,"" says lead researcher Benedikt Soja of ETH Zürich, a university in Switzerland. ""That was really surprising, and really an interesting revelation to us."" ""We can really become the dominant drivers of Earth's rotation, due to human-induced climate change,"" says lead researcher Benedikt Soja of ETH Zürich, a university in Switzerland. ""That was really surprising, and really an interesting revelation to us."" ""We can really become the dominant drivers of Earth's rotation, due to human-induced climate change,"" says lead researcher Benedikt Soja of ETH Zürich, a university in Switzerland. ""That was really surprising, and really an interesting revelation to us."" ""We can really become the dominant drivers of Earth's rotation, due to human-induced climate change,"" says lead researcher Benedikt Soja of ETH Zürich, a university in Switzerland. ""That was really surprising, and really an interesting revelation to us."" ""We can really become the dominant drivers of Earth's rotation, due to human-induced climate change,"" says lead researcher Benedikt Soja of ETH Zürich, a university in Switzerland. ""That was really surprising, and really an interesting revelation to us."" ""We can really become the dominant drivers of Earth's rotation, due to human-induced climate change,"" says lead researcher Benedikt Soja of ETH Zürich, a university in Switzerland. ""That was really surprising, and really an interesting revelation to us."" ""We can really become the dominant drivers of Earth's rotation, due to human-induced climate change,"" says lead researcher Benedikt Soja of ETH Zürich, a university in Switzerland. ""That was really surprising, and really an interesting revelation to us."" ""We can really become the dominant drivers of Earth's rotation, due to human-induced climate change,"" says lead researcher Benedikt Soja of ETH Zürich, a university in Switzerland. ""That was really surprising, and really an interesting revelation to us."" ""We can really become the dominant drivers of Earth's rotation, due to human-induced climate change,"" says lead researcher Benedikt Soja of ETH Zürich, a university in Switzerland. ""That was really surprising, and really an interesting revelation to us.""",Critical
science,"Did you know that the ocean produces approximately half of the world's oxygen ? Or that key medicines have come from ocean discoveries, like a painkiller found in a sea snail ? It's all true! And so is this fact: Scientists know more about space than Earth's ocean. Seriously, humans haven't seen 99.999% of the deep sea floor. With this comic, we explore some of the cool things scientists do know about the ocean and what dwells inside of it. Exciting news: We have a newsletter! It lets you go even deeper with the marine research each week of Sea Camp . Sign up here! This comic was written and illustrated by Angela Hsieh , based on reporting from Berly McCoy. It was art directed by Emily Bogle and edited by Rebecca Ramirez.",High
