NewsType,News,Impact
politics,"President Trump meets with Philippine President Ferdinand Marcos Jr. in the Oval Office at the White House on July 22. During a question-and-answer session with reporters while at the meeting, Trump railed against former President Barack Obama and other Democratic figures. Chip Somodevilla/Getty Images hide caption The Justice Department on Tuesday said it is in touch with an attorney for Ghislaine Maxwell, a longtime associate of sex offender Jeffrey Epstein , to try to arrange a meeting with her in the coming days. President Trump said he thought the development ""sounds appropriate,"" though he also claimed to know nothing about it. Deputy Attorney General Todd Blanche announced the plan on social media, saying that the department is seeking any information from Maxwell — who is serving time for sex trafficking — as part of its quest to uncover ""all credible evidence"" in the Epstein case. Trump, who was once friends with Epstein, is facing a backlash from supporters who want more information released about the disgraced financier's crimes and his 2019 death by suicide in prison. Trump has dismissed the uproar as a politically driven ""witch hunt"" distracting from his agenda. Asked about the newest development on Tuesday, he told reporters, ""I don't really follow that too much."" His comments to reporters came while he was meeting with President Ferdinand Marcos Jr. of the Philippines on trade issues. After the meeting, Trump announced on social media that importers of goods from the Philippines will face a 19% tariff , while U.S. exports to the country will face no tariffs. Trump spent most of his time in the Oval Office question-and-answer session railing against former President Barack Obama and other Democratic figures. Trump's spy chief, Tulsi Gabbard, recently published materials that she claims show that Obama officials ""manufactured and politicized intelligence"" about Russian interference in the 2016 presidential election. ""It's the most unbelievable thing I think I've ever read. So you ought to take a look at that and stop talking about nonsense,"" Trump told reporters — the ""nonsense"" referring to the Epstein controversy. Trump said it was ""time to go after people"" in connection to his allegations about the 2016 election. Obama's office issued a rare response, calling Trump's statements ""outrageous"" and noting that conclusions about Russian interference in the 2016 election had been widely accepted. ""These bizarre allegations are ridiculous and a weak attempt at distraction,"" Obama spokesperson Patrick Rodenbush said in the statement. Republicans in Congress have also been grappling with the Epstein issue. House Speaker Mike Johnson, R-La., announced Tuesday that the House would finish work a day early, canceling votes scheduled for later in the week. That means members will leave town for an annual August recess without a fresh confrontation over Epstein. The schedule change was announced after repeated clashes among Republicans about the files, including a deadlock in the powerful House Rules Committee over an effort by Democrats to force additional votes on the Epstein matter. NPR congressional correspondent Claudia Grisales contributed to this report.",High
politics,"There is an ongoing staffing crunch at the Social Security Administration. Here is one of the agency's field offices, on Staten Island, N.Y. Olga Ginzburg for NPR hide caption The Social Security Administration (SSA) recently reassigned a small share of its field office employees in an effort to bring down lengthy wait times for the agency's national 800 phone number. Workers at local offices across the country say these reassignments have been disruptive for staff and are increasing wait times for other services. Experts say the tradeoff is a byproduct of a declining Social Security workforce dealing with thousands more Americans who qualify for benefits every day. Thousands of employees have left the government agency in recent months. ""They are in a deep hole of their own creation on staffing and so you just don't have enough people to go around to serve the public,"" said Kathleen Romig, a former SSA official who's now director of Social Security and disability policy at the left-leaning Center on Budget and Policy Priorities (CBPP). ""And so all you can really do at this point is rearrange the deck chairs on the Titanic."" Earlier this month, about 4% of front-line workers were temporarily reassigned to cover the national 800 number, according to the SSA, which added that phone service has improved as a result. ""Thanks to a new telephone platform, most callers are now served quickly through callbacks or automated options, and answer times have already improved significantly in field offices,"" the agency said in a statement to NPR. ""By temporarily assigning a small percentage of field office staff to assist with 800 number calls, we can improve the 800 [number] average speed of answer without disrupting local services."" But Nicole Morio, a field office worker in Staten Island and union representative, said these reassignments have forced front-line staff to take on more work. ""The stress level is probably at a maximum for everyone,"" Morio said. ""At one point I think we were doing the work of 1.8 people. Now it seems as though we're doing the work of 10 to 15."" Monique Buchanan, president of an American Federation of Government Employees (AFGE) chapter that represents teleservice center workers, told NPR that the agency has also started to reassign vital claims specialists to the 800 number. Buchanan, who works at a field office in Detroit, said temporarily removing claims specialists from front-line positions is ""directly harmful to the public."" She said these workers finalize applications for people seeking help accessing benefits, such as payments for disabled children. ""These applications are taken through an interview that the claim specialist engages in,"" she said. ""So, the start is the interview with the claims specialist."" CBPP's Romig said staffing up the national hotline might not actually be faster for beneficiaries because so much work is done by claim specialists and other staff at field offices. ""Often customers can't actually complete their business on the phone,"" she said. ""They are going to have to end up in a field office ultimately anyway, or a field office employee is going to have to process that claim that has been taken on the phone or resolve the problem that has been raised on the phone."" The agency recently touted that it had reduced the average answering speed on the 800 number to ""13 minutes, a 35 percent reduction compared to this time last year and over a 50 percent reduction compared to last year's annual average."" But experts say it's harder to track whether the agency is doing better in other metrics. Recently the agency took down various real-time metrics from its website. Romig said it's possible wait times are decreasing as more people are transferred to 800-number duty, but it will surely come at the expense of other vital services. ""Sure, you can get a boost in a particular metric like phone hold times by making a massive shift of staffers to answer the phones,"" she said. ""But you do that by creating a new hole in the field offices, and that's what they're doing."" A Social Security Administration office on Staten Island, N.Y. Olga Ginzburg for NPR hide caption Morio, the Staten Island employee, believes she and other field office workers are being ""prevented"" from properly serving the people who need their help. ""We can't complete all of the things that need to be done,"" she said. ""When you have so little employees and so much work — it's stressful because we get hired to help the claimants. We get hired to help the American public. We're public servants. That's what we do."" Policy experts and front-line workers say that lowering wait times for phone services is a worthy goal, but it cannot be achieved without hiring more staff. Romig said staffing levels at Social Security were already at a decades-long low before the Trump administration began urging people to resign or retire early. According to agency officials, roughly 4,600 employees have left since March. Romig cautioned that staffing ""numbers are very hard to pin down"" because resignations are constantly ""in flux,"" due to the administration's deferred resignation program and ongoing early retirements. During a congressional hearing last month, new SSA Commissioner Frank Bisignano told members he does not believe increasing staffing is necessary to improve the agency's services. ""I do agree we must perform significantly better,"" he said, ""but increased staffing is not the long-term solution."" But Jessica LaPointe, who works at a field office in Madison, Wis., and is the president of the local AFGE chapter that represents 25,000 field office workers, said the shuffling of staffing is prompting even more people to leave the agency. ""If they decided not to take the buyout incentives that were offered in March, then now they're just leaving to save their mental health as their work keeps piling up,"" LaPointe said. ""It really is a manufactured crisis as a result of past changes that just continue to just make everything worse, sadly."" Some local field offices only have a few employees, so the loss of one can have a big impact. Juan Daniel Vasquez, who is a generalist technical expert in a field office in Monroe, Mich., said his office had an employee who covered the phones who was recently shifted to the 800 number. He said that since then, all the staff have been tasked with covering the phones, which has added a significant amount of work to everyone's plate. ""It's a lot tougher,"" Vasquez said. ""I'm nearing retirement age and … if you had asked me last year, I would have said I want to stay another five to seven years. Now I'm looking at one to two."" The agency told NPR that Bisignano has been ""visiting field offices and processing centers to hear directly from front-line employees,"" since his confirmation hearing. ""He is committed to giving SSA employees the tools they need to provide best-in-class customer service to the American public and succeed in their roles,"" the agency said in a statement. ""SSA monitors all workload measures in the field offices that are helping answer the 800 Number calls. In addition, we have established field office support units to assist with critical workloads and demands."" But LaPointe said that working conditions for field office workers in the past few months have only gotten worse. ""There's no indication that this is getting better,"" she said. ""We have an agency not listening to the workers.""",Critical
politics,"The seal of the Department of Defense at the Pentagon. Mark Wilson/Getty Images hide caption The Department of Homeland Security is preparing to use military bases in New Jersey and Indiana to detain immigrants who entered the country illegally, as well as to increase the number of immigrants detained at the U.S. Naval Base at Guantánamo Bay, Cuba, according to correspondence between DHS and the Pentagon obtained by NPR. According to the letter, dated July 15, Defense Secretary Pete Hegseth approved the moves, which were requested by DHS the previous month. Immigration and Customs Enforcement, which is part of DHS, had sought immediate access to Camp Atterbury, a National Guard base in Indiana, and Joint Base McGuire-Dix-Lakehurst, a base in New Jersey, from the Defense Department. ICE is also seeking to detain more immigrants without legal status at Guantánamo Bay prior to their final removal from the United States. ""DoD approves this support through September 30, 2025, subject to ICE maintaining a 24/7 oversight presence at each site to maintain custody and provide overall supervision of each site,"" stated the letter from Executive Secretary Anthony Fuscellaro to DHS acting Executive Secretary Andrew Whitaker. ICE staff and contractors will be responsible for all care and handling of the migrants, including meals, medical screening, transportation and medical services, according to the correspondence obtained by NPR. Neither DHS nor the Defense Department has yet responded to questions about the letter. On his first day in office, President Trump declared a national emergency at the southern border, enabling DHS to gain access to DOD's military resources. During congressional testimony, Todd Lyons, ICE's acting director, told lawmakers he did not expect DHS to repay the Pentagon for their costs. The approval letter notes that DHS will pay DOD for any costs associated with migrant detention at McGuire Field, the Air Force base in New Jersey. The request for the use of additional military bases, and expansion at Guantánamo, comes as the Trump administration has pushed to arrest and detain more people in the country without legal status. DHS has nearly 57,000 people in immigration detention, though it only has about 41,000 beds . The department has sought out contracts with the Federal Bureau of Prisons, local jurisdictions, and the use of military bases to detain migrants. By June, Guantánamo was holding about 500 migrants , though until now the base could only accommodate about 200 . In the letter to lawmakers obtained by NPR, Hegseth said that the use of the bases in Indiana and New Jersey for immigration detention ""will not negatively affect military training, operations, readiness, or other military requirements, including National Guard and Reserve readiness."" Camp Atterbury in Indiana will assist with removal operations out of the Chicago area; McGuire-Dix-Lakehurst in New Jersey will support Newark. Guantánamo Bay is designated to help with detentions and removals from Miami. The plan laid out by DHS calls for space for up to 1,000 people at the Indiana and New Jersey bases and to approximately double the capacity at Guantánamo to 400 people. DOD rejected a request from DHS for air transportation assistance until it got more details. In May, DHS asked for 20,000 National Guard members to assist ICE in its operations ranging from ""night raids"" and ""rural interdictions"" to guard duty at detention facilities. The Pentagon has already approved some 700 guard members to assist in Florida, Louisiana and Texas. A U.S. official, speaking on the condition of anonymity because they were not authorized to speak publicly, told NPR that hundreds more National Guard troops are expected to be called up to assist operations in Arkansas, Indiana, Iowa, Nebraska, South Carolina, Utah and Virginia. The Democratic congressional delegation in a statement condemned the terms of the use of the New Jersey base. ""This is an inappropriate use of our national defense system and military resources,"" they said in the statement. ""Using our country's military to detain and hold undocumented immigrants jeopardizes military preparedness and paves the way for ICE immigration raids in every New Jersey community. We have the greatest military in the world and using it as a domestic political tool is unacceptable and shameful."" In addition to using the military, the Trump administration is expected to be able to scale up its detention capacity due to an influx of funding from Congress. The recent tax and spending bill set aside $45 billion for immigration detention centers and $30 billion for more ICE personnel, transportation costs and to maintain existing ICE facilities.",High
politics,"US President President Donald Trump (L), Florida Governor Ron DeSantis (2nd-R), and Secretary of Homeland Security Kristi Noem (2nd-L) tour a migrant detention center, dubbed ""Alligator Alcatraz,"" Florida earlier this month DREW CABALLERO-REYNOLDS / AFP/AFP via Getty Images hide caption US President President Donald Trump (L), Florida Governor Ron DeSantis (2nd-R), and Secretary of Homeland Security Kristi Noem (2nd-L) tour a migrant detention center, dubbed ""Alligator Alcatraz,"" Florida earlier this month Since returning to office, President Trump has moved swiftly to upend decades of federal policy—from education to healthcare to vaccines...but nowhere more aggressively than immigration. Congress just passed tens of billions in funding for immigration enforcement...It's the largest domestic enforcement funding in U.S. history, fueling Trump's mass deportation campaign of migrants living in the U.S. illegally. President Trump campaigned for office promising the largest deportation in history. Six months into his second term, how has immigration enforcement changed. For sponsor-free episodes of Consider This, sign up for C onsider This+ via Apple Podcasts or at plus.npr.org . Email us at considerthis@npr.org . This episode was produced by Connor Donevan. It was edited by Eric Westervelt and Courtney Dorning. Our executive producer is Sami Yenigun.",Critical
politics,"President Trump answering questions at the White House on July 11, 2025. Win McNamee/Getty Images hide caption The Trump administration on Wednesday stepped up its attacks on ""woke"" artificial intelligence systems, a move propelled by the belief among some conservatives that AI models have drifted too far to the left. ""In order for all Americans to adopt and realize the benefits of AI, these systems must be built to reflect truth and objectivity, not top-down ideological bias,"" said Michael Kratsios, who leads the administration's office of science and technology policy, on a call with reporters on Wednesday. The Trump administration says more actions are expected on the ""woke"" AI issue, including an executive order later Wednesday. The White House is planning to revise Biden-era federal guidelines for AI safety to remove references to diversity, equity and inclusion, climate change and misinformation, according to the Trump administration's AI action plan. And soon, the federal government will only do work with tech firms ""who ensure that their systems allow for free speech and expression to flourish,"" Kratsios said on the briefing call, echoing language from the administration's policy documents instructing tech companies to rid AI models of liberal bias. It is the latest instance of the Trump administration turning the screws on DEI initiatives and railing against popular AI chatbots. Trump supporters have increasingly criticized the technology, saying safety guardrails end up censoring conservative views. ""The AI industry is deeply concerned about this situation,"" said Neil Sahota, a technologist who advises the United Nations on artificial intelligence issues. ""They're already in a global arms race with AI, and now they're being asked to put some very nebulous measures in place to undo protections because they might be seen as woke,"" he said. ""It's freaking tech companies out."" One possible way AI companies could respond, according to Sahota, is to unveil ""anti-woke"" versions of their chatbots with fewer safeguards in order to land the lucrative business of the federal government. ""If you're a tech company with a lot of government contracts, this order is a sticky wicket,"" Sahota said. While some studies have shown that popular chatbots can at times deliver left-of-center responses to certain policy questions, experts say it can often come down to how a question is framed, or what part of the internet the system is summarizing. AI scholars say there is no proof that any major chatbot has been intentionally designed to generate liberal answers and censor conservative views. ""Often what is happening with these criticisms is that a chatbot doesn't align with someone's respective viewpoint, so they want to place the blame on the model,"" said Chinasa Okolo, a fellow at the Center for Technology Innovation at the Brookings Institution, a think tank in Washington, DC. Turning ""woke AI"" into a rallying cry has parallels to a previous conservative battering ram against Silicon Valley: the belief that content guidelines on social media platforms were devised to muzzle right-wing perspectives. Last year, the howls over chatbots being ""woke"" intensified when Google's Gemini image generator depicted Black and Asian men as being U.S. founding fathers and Vikings as being ethnically diverse. Google executives apologized, and the company explained Gemini had overcorrected for diversity, including ""cases that should clearly not show a range."" Developing policies to counter such episodes has become a focus for White House AI czar David Sacks and Sriram Krishnan, a senior policy advisor in the Trump administration. It is a striking reversal from how the Biden administration approached the technology, when officials sought ways to enact barriers against AI perpetuating bias and potentially violating peoples' civil rights. Now, new energy has been breathed into making AI a part of the larger culture wars. Conservative activists seized on the Google Gemini snafu, but when Elon Musk's Grok chatbot flew off the rails earlier this month and launched into antisemitic tirades, few right-wing commentators responded. Just days later, the maker of Grok, Musk's xAI, was awarded a Defense Department contract worth up to $200 million , along with Google, Anthropic and OpenAI. ""Musk's original vision for xAI was a sort of 'anti-woke AI,' but when you control poorly for data quality and disable safeguards, you get things like the recent Nazi episode,"" said Talia Ringer, a computer science professor at the University of Illinois Urbana-Champaign. xAI blamed outdated software code on the meltdown. In particular, instructions that told Grok to be ""maximally based,"" a slang term for holding strong opinions even if they are troubling, which was reinforced by a similar instruction given to the chatbot: ""You tell like it is and you are not afraid to offend people who are politically correct."" The company said the issue has been fixed. Most popular chatbots have protections against things like slurs, harassment and hate speech, basic guardrails that may now be under new scrutiny by the Trump administration. ""Most of the examples I've seen conservatives cite of AI being too 'woke' are LLMs refusing to confirm conspiracy theories or racist claims,"" said Ringer, using the abbreviation for large language models, which underpin chatbot technology. To Okolo at the Brookings Institution, the battle over whether chatbots perpetuate left- or right-leaning views is overshadowed by another fight over the acceptance of provable facts. ""Some people, unfortunately, believe that basic facts with scientific basis are left-leaning, or 'woke,' and this does skew their perceptions a bit,"" she said. Doing the work of changing AI systems to respond to the White House executive order will be messy, said technologist Sahota, because where lines are drawn, and why, can initiate all sorts of political and cultural firestorms. ""What is even politically-driven? In this day and age, if someone says something about the importance of vaccination for measles, is that now a politically charged discussion?"" he said. ""But if there's potentially hundreds of billions of dollars in future federal contracts on the line, companies might have to do something, or they could be putting a serious amount of revenue in jeopardy.""",High
