NewsType,News,Impact
business,"This is a satellite image collected on Nov. 13, 2012, of the Maoniuping Mine, one of China's largest rare earth elements mines, located near Mianning, Sichuan province, China. DigitalGlobe/Maxar via Getty Images hide caption Deep in an underground, World War II-era vault on the outskirts of Frankfurt, Germany, investment manager Louis O'Connor guards his firm's most valuable assets. The treasure inside? Rare earth elements. ""Make no mistake about it, there's 3 1/2-meter walls and doors and armed security,"" says O'Connor, the CEO of Strategic Metals Invest, a firm that lets individual investors buy into stockpiles of rare earths. Many so-called rare earth elements are actually quite common, and they are mined globally, but China has a near-monopoly on refining them for use in everyday electronics, like smartphones and speakers, as well as for crucial defense systems, like fighter jets. When China decided to tighten control over supply chains for seven rare earth elements this spring, O'Connor says he felt the pinch immediately. One investor touring the company's vault at the time offered on the spot to buy O'Connor's entire inventory of terbium and dysprosium, two valuable ""heavy"" rare earth elements, he says. The episode illustrated the power of China's dominance over the industry. ""They're installing what you might call a tap system, where they can turn that tap on and off,"" says O'Connor, remarking on China's recent policy. That supply chain chokehold has given China a powerful tool it has wielded in a trade war with the United States. Within weeks of China requiring foreign companies to apply for a license to buy rare earths in early April, several U.S. and European corporations said they were forced to shut down production lines. Regaining access to Chinese rare earths was a central point of contention in U.S.-China trade negotiations this spring. But China did not always enjoy such dominance. Developing an export control regime they could minutely control took decades of sometimes painful trial and error. The Mountain Pass rare earth mine and processing facility, owned by MP Materials, is viewed from an airplane flying at 37,000 feet on Sept. 1, 2023, in Mountain Pass, Calif. George Rose/Getty Images hide caption For much of the second half of the 20th century, the United States controlled the market on rare earth elements, after prospectors discovered them in Mountain Pass , Calif., in 1949 . China recognized the strategic value of rare earths, and starting in the 1960s, Chinese executives visited Mountain Pass several times, says Mark Smith, who was the CEO at Molycorp, a former rare earths processing company at the Mountain Pass mine. ""We toured them. We explained what we do, allowed them to take pictures and everything else. They took it back to China,"" Smith says, who gave tours of Molycorp to Chinese visitors in the 1980s and 1990s. Chinese refineries then improved on technology, and taking advantage of cheap electricity in China, hundreds of lucrative mining and processing firms in the country popped up to service mostly domestic demand for rare earths. Loading... But the industry was highly unregulated and chaotic, as hundreds of small-scale, private mines and refineries competed against one another, undercutting each other's profits. ""They drive down the price against themselves,"" says Chris Ruffle, an investor who has worked in China for decades, including in the metals industry. ""They kill themselves."" China's then-industry minister, Xiao Yaqing, attends a news conference of the State Council Information Office on March 1, 2021, in Beijing. Visual China Group/Getty Images hide caption ""China's rare earths aren't being sold at a 'rare' price but at an 'earth' price,"" Xiao Yaqing, a former minister of industry, complained in 2021. As Chinese producers sought an upper hand in rare earths, they also unleashed unrestrained mining that came at great cost to the environment. In the early 2000s, Ruffle visited a private rare earths refinery in Jiangsu, a province in southern China. ""The thick smoke slightly gave it away,"" Ruffle says of the facilities. He describes huge piles of tailings — toxic, metallic by-products from other industrial processes — sitting on the bare ground. Destructive, small-scale mining was especially prevalent in southern China, where the most valuable, natural deposits of ""heavy"" rare earth elements are. ""They would mine the side of the hill with their axes and picks and shovels, and then they would dig a hole in the ground, no liners or anything like that at all. Then they poured five gallon buckets of sulfuric acid or hydrochloric acid … and let that certain stew for a while,"" remembers Smith, who frequently visited China during this period. ""When the storms come in, all that acid just washes out."" The mining left China's terrain scarred with lasting groundwater and soil pollution. Local residents staged periodic protests against rare earth mining, but the industry provided local governments with abundant revenue , and they repeatedly ignored central government orders to close down dirty mines. A Chinese media investigation into the industry in 2012 compared the rare earths industry in China during this time to trafficking illegal drugs. ""There are generally two types of people who can deal with rare earths: the first is someone who has just been released from prison, and the other is someone who can get someone out of prison. Those who are not afraid of death and leading cadres are all involved,"" the state media article said. Multiple Chinese businesses and individuals declined requests to comment for this story. By the late 1990s, Beijing had had enough of the domestic price wars and local pollution. It started imposing production and export quotas to incentivize more advanced processing of rare earths. The quotas also aimed to cut down on pollution by setting caps on how much mines and refineries could produce and protected the industry from foreign intervention. The quotas created two sets of prices, ""in effect, two-tier pricing, when exports were limited to the rest of the world that resulted in lower rare earth prices for domestic Chinese consumers,"" says Rod Eggert, a professor at the Colorado School of Mines. Samples of rare earth minerals from Bayan Obo mining district are on display at the Institute of Geology and Geophysics, Chinese Academy of Sciences, on May 17, in Beijing, China. Visual China Group/Getty Images hide caption There was also a second, unintended consequence to the quotas: they created a thriving smuggling industry. Up to 30% of the country's rare earth products in the mid-2000s was illegal, smuggled out of China despite state controls, analysts estimate, because of demand from Japan and the U.S. Then, American and European companies cried foul over the export quotas, and in 2014, the World Trade Organization ruled China could not use them. But China was unfazed. It was already shifting tactics. It would seek global dominance in rare earths not through controlling the volume of outputs, but instead, by controlling which firms could operate. Chinese central authorities dubbed the campaign ""one plus five"": an ambitious, and often ruthless, effort to winnow down the entire rare earth industry to just six consolidated companies. Authorities called the consolidation their ""secret war"" against illegal production. Starting in 2011, provincial authorities were instructed to mount unannounced audits of mines, to seize contraband ore and by-products, and when needed, dynamiting and smashing to pieces illegal mining operations. ""I saw firsthand how the private sector got squeezed out,"" says Ruffle, the investor. Within four years, China declared victory. It announced the closure of dozens of smaller mining and refining companies and guided the mergers of surviving companies into six supersized, mostly state-owned firms, nicknamed the Big Six in China. Through the Big Six, China could now largely control both supply and price. ""Whereas before you had a lot more competition from different producers, now you get very homogeneous pricing,"" says Jan Giese, a Frankfurt-based rare earth trader. ""It's difficult to have competitive bids."" Unlike metal commodities like nickel or gold, there is no independent exchange for buying and selling rare earth elements. Because Chinese companies can cause huge price fluctuations depending on how much they decide to produce or export, investors have been wary of pouring money into new ventures in the U.S., say U.S. refining and mining companies. That has made raising capital to build refining plants a big challenge for American companies trying to break back into the industry. NioCorp CEO Mark Smith talks to a group of investors Oct. 6, 2021, about the prospects for a mine near Elk Creek in southeast Nebraska. Smith is a former CEO of Molycorp. Josh Funk/AP hide caption ""They're putting their money into things like Alphabet and, you know, Amazon and, you know, all the high-flying types of investments and just very, very little, if any, is coming into the mining industry,"" says Smith, the former CEO of Molycorp. Some are still trying. Smith's new venture, NioCorp, is opening new mines and refining capacity for rare earths in Nebraska . Tomas Villalón, chief technology officer and co-founder at Phoenix Tailings, poses for a portrait on June 11. David L. Ryan/Boston Globe/Getty Images hide caption Phoenix Tailings, a startup in Massachusetts, is also among a handful of U.S. companies prepared to refine rare earths, by refining the tailings, or leftover waste, from mining companies. ""We have to be full speed on the gas to make sure we're successful here,"" says Nicholas Myers, one of the co-founders and CEO. The company already makes rare earth magnets for automotive and defense companies, and it is currently building a second plant in New Hampshire which the company says can meet about half of the U.S.' defense needs for rare earth products. For years, Myers says his company struggled to attract investment at the magnitude needed to compete with Chinese firms in scale. This year, things changed, after China implemented a licensing system for foreign companies which caused rare earth exports to plummet. ""Definite tone shift,"" says Myers, ""I think what happened is the end customers, the folks at the big automotive companies or defense primes, realized that they had told their bosses that China would never shut off the supply for them."" But China did shut off that supply. The sudden cutoff galvanized U.S. investor interest in rare earths, Myers says. Phoenix Tailings garnered a major round of investment in May, and now, for the first time in decades, the U.S. may refine rare earth elements again. Emily Feng reported from Burlington, Mass., and Washington, D.C. Aowen Cao contributed research from Beijing.",Medium
business,"It's week three of summer school, government edition. So far this semester we've looked at how the government can help make us all richer (or poorer) and how we use taxes to change behavior and show our values. This week — How does the government decide what to do with all the money it collects? Woohoo! Government spending spree! Although it seems like the government can spend an endless amount of money, it cannot actually do all the things it wants to do.  So the big question in this week's lesson is: How do we decide? Why does the government spend so much money on some things and not on others? And honestly, is there any limit? Get tickets to our August 18th live show and graduation ceremony at The Bell House, in Brooklyn. The series is hosted by Robert Smith and produced by Eric Mennel. Our project manager is Devin Mellor. This episode was edited by Planet Money Executive Producer Alex Goldmark and fact-checked by Sofia Shchukina. Help support Planet Money and hear our bonus episodes by subscribing to Planet Money+ in Apple Podcasts or at plus.npr.org/planetmoney . Always free at these links: Apple Podcasts , Spotify , the NPR app or anywhere you get podcasts. Find more Planet Money: Facebook / Instagram / TikTok / Our weekly Newsletter .",Critical
climate,"What remains of the ""Tree of Life"" on Sunday, July 20, 2025, is visible off the coast of Efate Island, Vanuatu, after being toppled by cyclones in 2023 and further damaged by an earthquake in 2024. Annika Hammerschlag/AP hide caption THE HAGUE, Netherlands — The UN's highest court is handing down a historic opinion on climate change Wednesday, a decision that could set a legal benchmark for action around the globe to the climate crisis. After years of lobbying by vulnerable island nations who fear they could disappear under rising sea waters, the U.N. General Assembly asked the International Court of Justice in 2023 for an advisory opinion, a non-binding but important basis for international obligations. A panel of 15 judges was tasked with answering two questions. First, what are countries obliged to do under international law to protect the climate and environment from human-caused greenhouse gas emissions? Second, what are the legal consequences for governments when their acts, or lack of action, have significantly harmed the climate and environment? ""The stakes could not be higher. The survival of my people and so many others is on the line,"" Arnold Kiel Loughman, attorney general of the island nation of Vanuatu, told the court during a week of hearings in December. In the decade up to 2023, sea levels have risen by a global average of around 4.3 centimeters (1.7 inches), with parts of the Pacific rising higher still. The world has also warmed 1.3 degrees Celsius (2.3 Fahrenheit) since preindustrial times because of the burning of fossil fuels. Vanuatu is one of a group of small states pushing for international legal intervention in the climate crisis but it affects many more island nations in the South Pacific. ""The agreements being made at an international level between states are not moving fast enough,"" Ralph Regenvanu, Vanuatu's minister for climate change, told The Associated Press. Any decision by The Hague-based court would be non-binding advice and unable to directly force wealthy nations into action to help struggling countries. Yet it would be more than just a powerful symbol, since it could serve as the basis for other legal actions, including domestic lawsuits. ""What makes this case so important is that it addresses the past, present, and future of climate action. It's not just about future targets -- it also tackles historical responsibility, because we cannot solve the climate crisis without confronting its roots,"" Joie Chowdhury, a senior attorney at the Center for International Environmental Law, told AP. Activists could bring lawsuits against their own countries for failing to comply with the decision and states could return to the International Court of Justice to hold each other to account. And whatever the judges say will be used as the basis for other legal instruments, like investment agreements, Chowdhury said. The United States and Russia, both of whom are major petroleum-producing states, are staunchly opposed to the court mandating emissions reductions. Simply having the court issue an opinion is the latest in a series of legal victories for the small island nations. Earlier this month, the Inter-American Court of Human Rights found that countries have a legal duty not only to avoid environmental harm but also to protect and restore ecosystems. Last year, the European Court of Human Rights ruled that countries must better protect their people from the consequences of climate change. In 2019, the Netherlands' Supreme court handed down the first major legal win for climate activists when judges ruled that protection from the potentially devastating effects of climate change was a human right and that the government has a duty to protect its citizens.",High
climate,"Experts say there are key questions parents and guardians should ask camp operators about wildfires, flood and heat risk. Danielle Villasana for The Washington Post via Getty Images hide caption The deaths of at least 27 children and staff at Camp Mystic in Kerr County, Texas have some parents and guardians questioning the safety of summer camps, especially as global warming increases risks of extreme weather. Part of summer camp's allure is that children are outside in nature. But that can also raise the possibility of heat illness and risks from greater proximity to wildfire or flood-prone areas, says Tracey Gaslin,  chief executive of the nonprofit Alliance for Camp Health in Kentucky. Outside of regulations that apply to all businesses, there are no federal standards that are specific to camps, says Henry DeHart, interim chief executive of the American Camp Association (ACA). The ACA has a national accreditation program that includes some health and safety standards, but it's voluntary and only about 12% of the country's roughly 20,000 camps have participated, he says. On the state level, DeHart says some state agencies conduct camp health and safety inspections. But oversight and protections vary considerably from state to state, and some states have very little regulation. ""There are a lot of states that have very little or no regulation related to camp,"" DeHart says. ""The regulatory framework is wide and varied and, in some places, it's not very robust."" Because of the gaps in the current regulatory framework, some experts on climate-related risks say parents and guardians should ask more detailed questions about campers' safety. Chad Berginnis, the executive director of the Association of State Floodplain Managers , dropped off his 8-year-old daughter at Girl Scout Camp earlier this month, and realized he, too, had many more questions about his daughter's camp's flood precautions. ""Even as a floodplain manager,"" he says, ""I don't think I even had appreciation for what, as a parent, I should be thinking about when sending kids to camp."" Now, Berginnis has a list of points to cover. For parents or guardians sending children to any kind of camp, here are the top questions experts say you should be asking about increased risks of heat, wildfires and floods. Camps can be great for kids, but can also expose them to heat. Children and teenagers' developing bodies aren't as good at regulating their body temperatures as adult bodies. Serhii Bezrukyi/Getty Images hide caption This question is important because heat-related illness and death are major and growing risks in the U.S. —and that threat is often underestimated. Also, children and teenagers' developing bodies aren't as good at regulating their body temperatures as adult bodies, says Rupa Basu,  senior science advisor for the University of California, San Francisco Center for Climate Health and Equity . That makes them more at risk for heat illness, she says. ""I  think that people don't even think of children often as being high risk populations,"" Basu says. "" But they absolutely are."" For these reasons, Gaslin at the Alliance for Camp Health thinks parents and guardians should be asking camps how they are thinking about heat and hydration. She suggests parents and guardians ask about how the camp's physical site is designed. "" Do you have things like shade structures? Misting systems?"" Gaslin says. ""A really solid infrastructure build is important."" Gaslin also thinks parents and guardians should be asking about how ""climate-aware"" the campers' schedules are. That can look like an activity in a cool location, then an activity outside in a warmer location, then back into the cool, she says. Also it's important to ask about how frequently counselors are reminding campers to hydrate. ""It's really about giving conscious thought to how do we manage that impact of heat,"" she says. "" If we're gonna be outdoors, guess what? Water activities are a great thing to do."" Chad Berginnis, the executive director of the Association of State Floodplain Managers, thinks parents and guardians need to know if their kids' camp is in a floodplain, and what the camp is doing about it. Ronaldo Schemidt/AFP hide caption This question is key because many camps are located in flood-prone areas, Berginnis says. He says – in many ways – that's understandable. ""To me, it makes logical sense that you'd have a lot of camps there because it has really interesting habitats. It has interesting animals and geology and everything, and kids can learn a lot there,"" Berginnis says. But he thinks parents and guardians need to know if their kids' camp is in a floodplain, and what the camp is doing about it. Berginnis says adults can look up risks on this FEMA website . Parents and guardians can also plug in addresses to this database from First Street , a climate risk modeling company. If it's a sleep-away camp, Berginnis says it's important to ask where the kids' sleeping quarters are located. ""If it's an overnight camp, any kind of residential lodging overnight for the kids, if it's in a floodway, that should be a huge red flag right there,"" he says. And he says parents and guardians should ask camps about things like flood sirens and specifics of emergency action plans. "" I would be very blunt with a campground: I wanna know the procedure. If a flash flood warning is declared for the area, what does the camp do? What do the counselors do? So that they can talk it through with you,"" he says in an email. ""Do not be satisfied with a generic answer like 'we have an emergency action plan'. Ask them about specific actions like is there anyone monitoring the weather at night? What are the designated evacuation areas? And if they cannot talk that through with you, again, I would say, that's another red flag."" Tracey Gaslin at the Alliance for Camp Health says parents and guardians should make sure that all camp emergency action plans are regularly updated and reviewed by local emergency partners, including emergency medical staff. Sandy Huffaker/Getty Images hide caption As with flood risks, parents and guardians should be asking about emergency action plans and preparedness for wildfire and smoke, Gaslin says. ""Parents can ask camps, do they monitor air quality?"" she says, ""What's their evacuation plan? How are they gonna communicate with families? So families are gonna be able to say, in a moment of crisis, I wanna be able to communicate with you in some way."" Gaslin says it's important to make sure that all camp emergency action plans are regularly updated and reviewed by local emergency partners, including emergency medical staff. Gaslin says parents and guardians should make sure there are always staff monitoring the weather, and at sleepaway camps there should be a solid communication system so at night, individuals are alerted to environmental changes or concerns. That means at least some staff with cell phones and radios at all hours, to monitor for wildfire risk, flash floods, or any other hazards.",Critical
